Comment_Body,Author,Upvotes,Awards,Date
Margot isn’t playing a 2nd tier role in a Marvel movie…her star is still strong…leave that too the now b-list actresses…,Heru4004,0,0,2023-07-25 00:49:11
A complete misfire,Thatoneguy567576,0,0,2023-07-24 23:45:15
I think it’s actors reading the writing on the wall and reassessing their need to be big Marvel players.  Margot Robbie gets nothing out of being Sue Storm other than the headache of having to deal with the Marvel schedule.,Banesmuffledvoice,0,0,2023-07-25 00:28:25
"I’d bank on it being average.

I’m really not familiar with Margot Robbie’s acting outside of Harley, so I have no idea if she could’ve pulled it off.

I just feel like people would’ve wanted to see a fresh face in the role either way.",ColdNyQuiiL,0,0,2023-07-25 00:36:13
"Misfire. It would be just like Jessica Alba as sue storm. I would need an audition first. Sure she was great as Harley Quinn, but that’s a very stylized performance. Sue storm him as a character just seems like a dud. Robbie’s too big. Honestly, krazinski as Richard and blunt as sue. A blunt can do big and broad but she can also do subtle. 

it’s hard to explain. It’s kind a like if you wanna party you call Margot Robbie but if you want to get some shit done, go with Emily Blunt. If that makes any sense",homerbartbob,0,0,2023-07-25 00:44:36
It’s beneath her at this point,Calm_Green3821,0,0,2023-07-25 01:06:25
"The MCU is on a downward spiral, it only makes sense that she’d back out.",MajorThor,0,0,2023-07-25 01:08:35
"The problem with this question is Jessica Alba, Jessica is a great actress and a knockout  who brought a strong personality to the roll, Margo would have a very small set of changes she could apply to the character to differentiate her performance …. Tough job for anyone other than Jessica Chastain or Charlize Theron",Alt-Rick-C137,0,0,2023-07-25 02:54:04
"Misfire

Superhero movies are dead",Darksawyerx,0,0,2023-07-25 05:16:43
She can’t play everyone!,seantubridy,0,0,2023-07-25 07:49:53
"Superhero movies nowadays are to A-List actors what Las Vegas is to pop divas. It is where careers go to die, with the Joker being an exception. Margot Robbie doesn't need that shit.

This type of movie has also saturated the market for too long and nobody can take the shitty scripts anymore. Probably some actress from a TV series who has been struggling to find decent work will take the part and it will go straight to Disney Channel.",Loud-Cry-391,0,0,2023-07-25 11:54:05
"Smart of her, marvel movies are on the decline. They have to get out of this multi-verse crap, leave it to atsv",Odd_Break_5200,0,0,2023-07-25 13:35:52
I wish they could have found a way to circle back and cast Natalie Dormer as Sue. Since it's supposed rumored to be a period piece,VikusVidz,-1,0,2023-07-25 00:25:58
The “Target” of hot blonde actresses.,turkish3187,-1,0,2023-07-25 00:35:02
Average. She’s no great actress but she would have been appealing.,ElvishLore,-1,0,2023-07-25 05:27:45
She doesn't have range,Unlucky_Disaster_195,-1,0,2023-07-25 05:39:29
I can't take anyone that pretty seriously.,shelsbells,-2,0,2023-07-25 01:11:09
"Nice touched up picture, but she's too old for the role.",TampaNutz,-2,0,2023-07-25 01:16:17
She sucked as Harley Quinn so no loss for Sue Storm hopefully it goes to a better actress.,Nikkothadon,-16,0,2023-07-24 23:21:16
Misfire because marvel is not focus on making a movie.  Their focused on the movement or whatever issues that surrounds us.,Chemical_Product5931,-5,0,2023-07-24 23:35:31
She’s a horrible actress so any role she’s cast in is a compete misfire,milkstrike,-4,0,2023-07-25 01:08:27
shes great and sue is flexible so she could easily pull it off well. i also think there are more interesting options.,duende_master,1,0,2023-07-24 23:37:57
"She would have been fine, but too expensive.",New_Needleworker6506,1,0,2023-07-24 23:42:54
"I honestly think Margot is a great actress and many fans decided before she was even chosen, that she was going to be terrible in the role. No wonder she didn’t want it. Fanboys ruined it for her before they even gave her the job.",LochNessMansterLives,1,0,2023-07-24 23:53:32
Keep her at DC. Marvel can't have ALL the talent 😭,Almighty_Push91,1,0,2023-07-24 23:58:26
She could’ve been a good contrast to an Adam Driver Reed. She stands out while he hides behind his work. I can see a Johnny loving the attention of being the human torch when his sister has been Barbie his whole life. Plus her performance in I Tonya shows she can show her fangs. Not one to mess with when you put her fam & innocent people in danger.,AdditionalInitial727,1,0,2023-07-25 00:05:43
Misfire for sure,avi150,1,0,2023-07-25 00:08:10
Imogen Poots,claud2113,1,0,2023-07-25 00:13:03
"She'd be maybe the worst possible choice, through no fault of her own. She already nailed a fun, crazy comic book character - it's an automatic letdown by comparison to play a more straightforward heroic type.

I'd cast Meghann Fahy from White Lotus Season 2. Excellent actress who can make a meal out of any material, for her it would be a big break and she'd be driven to make the most of it, and the subtle things that make Susan Storm complex and interesting in her best stories are exactly her bread and butter. She'd surprise you with acting chops when you least expect it, which is exactly what the role needs.",NotABonobo,1,0,2023-07-25 00:13:26
"Average. Margot's a great actress, but Sue isn't a great match for her. 

I think she'd have a great performance but be an average Sue character-wise.",AirWalker9,1,0,2023-07-25 00:21:31
This just makes me sad how Phase 4 has nothing to do with F4 or X-Men. Kind of makes me wish they are in their own isolated universe. Not every marvel origin has to be Homecoming.,OneMetalMan,1,0,2023-07-25 00:22:29
Phoebe Tonkin?,Brief-Outcome-2371,1,0,2023-07-25 00:26:06
"She is a great actor, so great",slade707,1,0,2023-07-25 00:27:08
"I think she would’ve been Great.

But she’d also have to be locked into at least a decade of the role and I don’t think that’s her gig.",Writerhaha,1,0,2023-07-25 00:28:18
She would have been great,sir_duckingtale,1,0,2023-07-25 00:32:21
"Look. 

Margot Robbie is a VERY talented actress. I think she’s been consistently phenomenal in everything she’s been in regardless of the quality of the film. She’s great. 

But I don’t really think Sue Storm was a good fit for her. I think Vanessa Kirby is a stronger choice",DirectConsequence12,1,0,2023-07-25 00:34:40
She would have probably been great. But I get why she would choose not to,tsengmao,1,0,2023-07-25 00:36:06
I think shes literally the best they could have asked for for the role.,Wazula23,1,0,2023-07-25 00:37:43
I really am not enjoying super hero movies using the same 6 actors for every movie.,Comet_Empire,1,0,2023-07-25 00:40:00
Shes Harley.,Select_Nectarine8229,1,0,2023-07-25 00:42:33
"Made a post today actually, Elizabeth Banks could play Sue",F74NK,1,0,2023-07-25 00:45:49
Sue Storm is too boring as a character for Margot Robbie,MarcoVinicius,1,0,2023-07-25 00:47:22
It would be crazy if they casted any other actress in hollywood.,Dragmire_Afterlife,1,0,2023-07-25 00:51:44
"How old or young does Sue need to be? I think Elisha Cuthbert could work but she's already 40. 

I think an actress like Shailene Woodley or Emma Watson would be a great Sue Storm.",1trillion69,1,0,2023-07-25 00:53:26
Average,Philbin27,1,0,2023-07-25 00:54:45
They better pick an excellent character for her someone that she can use her acting chops with,gknight702,1,0,2023-07-25 01:00:10
Meghann Fahy should play Sue.,adminsrpetty,1,0,2023-07-25 01:01:36
Jodie Comer as Sue Storm and Vanessa Kirby as Emma Frost is my wish,kingkibc,1,0,2023-07-25 01:02:23
It would have been great and without her it will be great. Y'all chill,the_reql,1,0,2023-07-25 01:03:22
Barbie was a Marvel Comic in the 90s so she should just continue to be Barbie in the MCU.,aztnass,1,0,2023-07-25 01:05:13
Jessica alba!,Equal-Wishbone-6131,1,0,2023-07-25 01:06:46
I think she made a good choice. Just don't see it,kal_houseofel,1,0,2023-07-25 01:13:58
Sydney Sweeney from euphoria very talented and is a very talented mma fighter shocking,Mrdynamo18,1,0,2023-07-25 01:16:33
What’s the point of casting Margot Robbie if she’s going to be invisible?,Dgf470,1,0,2023-07-25 01:18:59
I was dreading seeing her as Sue Storm. Felt the same way about Adam Driver.,Blindfolded22,1,0,2023-07-25 01:21:41
"I love Robbie but I’ve never seen her in a role I would call “subtle”. She’s larger than life, and I think Sue Storm needs a little subtlety.",smthngclvr,1,0,2023-07-25 01:26:58
I think Margot could’ve played it greatly but I’m sure there’s better characters she could play like Emma frost,Lopsided_Tension413,1,0,2023-07-25 01:27:01
Complete misfire. Not every actor is meant for every role. She'll be a million times better in other things.,MisterZacherley,1,0,2023-07-25 01:28:36
"She would've been alright. I don't know if I think she's the best choice, but she's far from the worst.",pje1128,1,0,2023-07-25 01:31:11
Complete misfire. Fantastic 4 is like Dune. Done twice but never done right yet . Feige knows F4 was the top seller 60s to 70s so strategically since Iron Man he planned to leave them as well as Silver Surfer and Namor converted to a hero way at the end of the series. Saving best for last.,Mace-Window_777,1,0,2023-07-25 01:31:30
"I'd watch Margot Robbie in just about any role, she's usually pretty awesome. I think this is one of those things that it would all come down to the script.   


Who's writing it, is the budget spent getting the four cast with big names? Will there be enough for a good animation team that isn't spread thin, or are we going to Deadpool this and forget the guns?   
A lot could make this movie a dumpster fire without Margot Robbie screwing up.",John0ftheD3ad,1,0,2023-07-25 01:35:06
Blonde and pretty can’t be the only requirements for this character. The casting would’ve been fine but there exist better options,TheBlindBard16,1,0,2023-07-25 01:38:16
She would have been perfect! Why did she drop out??,Positive_Round_5142,1,0,2023-07-25 01:39:15
"Complete misfire, unless you want an MCU Harley Quinn. That’s the only character she’s ever played in her career.",Xelent43,1,0,2023-07-25 01:41:55
Maybe she read the script or outline and thought it was shit? Every Fantastic Four film has been shit. Probably a good idea but I haven’t read the script.,JackKovack,1,0,2023-07-25 01:44:14
Id prefer Vanessa Kirby in the role,Bearjupiter,1,0,2023-07-25 01:47:03
She's Barbie. She can do any roles!,DJBR95,1,0,2023-07-25 01:48:49
"Im m tired of seeing her everywhere, it wouldve been a misfire",AerialAce96,1,0,2023-07-25 01:49:42
Sue needs to have a mothering edge. I don’t see that coming from Robbie at this point.,Flight305Jumper,1,0,2023-07-25 01:51:20
Misfire.  I want her to be a pretty blonde with a touch of nerd.  Think Ultimate Sue Storm.,Southern_Name_9119,1,0,2023-07-25 01:52:57
Emily Blunt would have been the most ideal choice.,TheStigianKing,1,0,2023-07-25 01:57:42
Great decision by Margot. Time to end the mcu overkill.,jumptick,1,0,2023-07-25 01:59:35
Gillian Anderson could be awesome.,Bob25Gslifer,1,0,2023-07-25 02:00:42
Great,Brilliant_Claim1431,1,0,2023-07-25 02:11:11
Average at worst. Definitely not a complete misfire,rgregan,1,0,2023-07-25 02:16:51
It will have to be Emily Blunt as Susan Storm ofc.,Capteverard,1,0,2023-07-25 02:17:08
Woulda been great.,flexo_isgreat,1,0,2023-07-25 02:17:57
I think she’s way too prominent an actress for any main marvel role.,2_72,1,0,2023-07-25 02:19:20
"why recycle all the same actors? disgusting. she was DC. LET IT BE.
a actor showing up in multiple comic movies should be a VERY RARE exception-
get some
imagination, people!",joeldouglasealy,1,0,2023-07-25 02:20:52
What a boring character to drag her down with,Unlucky-Ad-4333,1,0,2023-07-25 02:25:19
"the only time i think margot robbie would be a good fit for Sue is that weird 4 shaped boob window phase  
that said. the only things i've seen her in are wolves of wall street, as Harley, and snippets of Barbie  
I've never seen ""its the 50's woman trope"" sue, or the ""competent mom"" roles for margot or edge lord sue or kill a bitch sue or anything related to those sort of roles  


has there been an existential crisis sue?",EngineeringDevil,1,0,2023-07-25 02:33:18
Margot is too good to stoop to that level,nn_lyser,1,0,2023-07-25 02:45:21
"Margot is good, but this never felt like something right for her. There def would be a million ""They wasted Margot Robbie"" posts after that movie.",fringyrasa,1,0,2023-07-25 02:45:58
Average.,FlamingTrollz,1,0,2023-07-25 02:46:21
I think her agents and shit know it’s gonna suck so they’re keeping her clear of it.,justed87,1,0,2023-07-25 02:47:17
I think Margo needs to let other actresses have some roles in Hollywood,misterturdcat,1,0,2023-07-25 02:51:41
Being in a fantastic 4 movie hasn't gone very well for anyone yet.,Majestic-Alfalfa-754,1,0,2023-07-25 02:54:45
Misfire in that role,Environmental-Tip365,1,0,2023-07-25 02:55:22
"I would imagine she wouldn't want to be held back by marvel contracts. Shes at the peak of her career, I doubt she's gonna want to miss out on an Oscar bait movie because she has to film as 30sec cameo in Captain America 7.",skateboardlee,1,0,2023-07-25 03:02:07
Nothing can save Fantastic Four. How many reboots have they tried?,SaltChildhood7,1,0,2023-07-25 03:02:25
"Honestly? She’s too good for the MCU.

These Phase 4 and 5 writers/directors have been horrible, and I wouldn’t want to see her wasted on the MCU when there are much better projects and directors out there that can use her talents.

Really hope Emily Blunt doesn’t sign on either. Oppenheimer proved her as one of the greats of her generation. She doesn’t need to be dragged down by the MCU.",EliteVoodoo1776,1,0,2023-07-25 03:10:24
"Give some slightly lesser known but skilled actors a chance, I say.  Sue should be beautiful but in a down to earth kind of way. Like Namor is supposed to be down very bad for her and I just get the vibe it would be less about hyper sexuality and more about effortless femininity. Margot has the acting chops but shes just so damn hot that I look at her and just see Margot instead of whatever role she's playing. Plus it seems like Margot is in everything these days.

Also depends on the age range, if mid to late 30s is the range, I like Lea Seydoux though I can't say I've heard her do an American accent. Nathalie Emmanuel as a blonde might be interesting and they could kind of repeat F4s race swap of Johnny Storm and it wouldn't have to be explained by adoption. Samara Weaving might be a good early 30s choice, along with Emily Rickards.",WhatUDeserve,1,0,2023-07-25 03:36:42
Did she think she wasn't smart enough to play this part? I don't understand how you could turn this down.,uofartr,1,0,2023-07-25 03:38:24
He'll naw she's overrated,Blackpanther22five,1,0,2023-07-25 03:41:52
"It would have only worked if she looked sounded and acted like Harley Quinn, otherwise complete misfire and one of the worst castings since micky rooney as that Asian guy in To Sir With Love, Julie Newmar",Permanenceisall,1,0,2023-07-25 03:47:17
Mids,Disastrous_Duty2622,1,0,2023-07-25 03:52:27
Vanessa Kirby is my top pick for Sue Storm. It was Jodie Comer but she already confirmed it won't be her.,RickSanchez813,1,0,2023-07-25 04:05:48
"If anything, she would have made a great Dazzler.",chicano32,1,0,2023-07-25 04:07:01
It will likely be an unknown since Marvel does 6 picture contacts and that is quite the commitment,Sardaukar99,1,0,2023-07-25 04:08:01
I think Alice Eve would make a good Sue while growing into the role.,Sol-Blackguy,1,0,2023-07-25 04:15:55
"After watching the edge of tomorrow, my opinion is reinforced that Emily blunt would be a great casting choice for Sue Storm.",LiberalDysphoria,1,0,2023-07-25 04:16:23
I think she would absolutely nailed it but it would be too much margot robbie playing iconic characters,bulkingforever,1,0,2023-07-25 04:17:55
"My initial reaction was misfire, but it's hard to say. She's a talented actress, so I wouldn't bet against her.",Bogusky,1,0,2023-07-25 04:17:57
Good for her.,LocalsOnly84,1,0,2023-07-25 04:19:14
That'll be Awesome!!!,Guja7419,1,0,2023-07-25 04:22:42
"Nah, she's in too many things, could spread her thin.
Feel like we need à relatively unknown with potential",Saixcrazy,1,0,2023-07-25 04:28:43
There's no way that they are doing a fantastic four movie. At best we might get cameos from the group like we did in that doctor strange movie,ThiccWurm,1,0,2023-07-25 04:30:06
"I say it would've been fine. She's a good actress,she killed it with Harley Quinn and Barbie and hell, a lot of people were upset about Scarlett Johanson getting Black Widow, UNTIL they actually saw her in the movie, so I think she would do fine as Sue Storm. Especially since there hasn't been many Sue Storms in live action anyway, and the ones that were people didn't like.",LadyEncredible,1,0,2023-07-25 04:31:36
I think every fantastic four character needs to be a reactively unknown actor. They need to approach it like they did the original avengers.,tread52,1,0,2023-07-25 04:31:53
"Rogue, i would use her as rogue. Her energy wasn’t right for sue storm.",Krsbowers,1,0,2023-07-25 04:34:21
She seems like she can play any role that's put in front of her.,gargamel314,1,0,2023-07-25 04:50:59
Complete misfire,Icy_mane,1,0,2023-07-25 04:51:48
"I honestly want a 40 year old Sue with kids who's five minutes from divorcing Reed every other week. Just dive right into the good stuff.

Sue Storm Agent of ~~SHIELD~~ SWORD, know what I mean?",BZenMojo,1,0,2023-07-25 05:02:24
"I don't see it being much good. 
She doesn't need another comic book role anyways, Harley Quinn will always be near the top of her best roles.",JamesUpton87,1,0,2023-07-25 05:05:11
Misfire...8f she's a hero again she it's someone who can have swag like Harley quinn,silGavilon,1,0,2023-07-25 05:11:50
Any chick could do it: she would probably have been locked into a 6 movie deal,boosie234,1,0,2023-07-25 05:17:03
"Not in the current state of marvel. she would look stupid in their phase 4 and 5 costumes. I love captain marvel, but the marvels has the worst costume designs for all 3 in the trailer including the villain. Spy Kids level.",Sulley87,1,0,2023-07-25 05:23:03
Missfire,mexikan_panda,1,0,2023-07-25 05:24:26
"After Barbie , she better not be Sue.",leukemija,1,0,2023-07-25 05:48:28
"She certainly had the look of Sue, but I’m still holding out hope for someone who can bring big “mom” energy to the role. Something a little different from the rest of the female characters in the mcu right now. 

I don’t know who that is yet, but Robbie was way too big a name for this part anyhow.",TheAgashi,1,0,2023-07-25 05:52:26
I don’t think that picture on the left is her? Looks like a lookalike of hwr,analbumcover42069,1,0,2023-07-25 05:53:41
Wait so it’s confirmed that she will not be playing her?,Ok-Reporter-8728,1,0,2023-07-25 06:02:10
So Kang is…  never mind,Happily-neverafter,1,0,2023-07-25 06:15:59
"I didn’t see her as Sue, personally. Maybe as an Emma Frost or Dazzler (though I’d prefer Gaga play Dazzler), but not Sue Storm",FPSGamer48,1,0,2023-07-25 06:22:58
She’d rocked it,blkglfnks,1,0,2023-07-25 06:31:25
Misfire. They need to really get this right and think long and hard about the cast. Not just hire big name celebs for no reason,Significant_Ad1898,1,0,2023-07-25 06:35:51
I think shes phenomenal. Perfect harley cast. But no sue storm would not be a good fit. Same with adam driver. Great actor but plz keep him out,Judgejudyx,1,0,2023-07-25 06:37:57
Nope don’t see her as such. The DCEU movie with her was a disaster.,tom-8-to,1,0,2023-07-25 07:10:41
One reason marvel was so good in the beginning is because they got a lot of actors that didn’t have a big presence in Hollywood. Now they cast “superstars” in every roll only making the expectations go up when the quality is going down.,Wonderful-Media-2000,1,0,2023-07-25 07:22:45
Misfire,Active-Ad1679,1,0,2023-07-25 07:29:28
I think comic book movie fans need a bigger scope of actors,fyester,1,0,2023-07-25 07:44:40
I think with the right director it could work,LUMPIERE,1,0,2023-07-25 07:51:04
She'd be perfect for Emma Frost,Global_amaze,1,0,2023-07-25 08:06:12
Personally I'm glad she opted out. She played Harley for what three movies?  Probably tried of filming comic roles.,dujuan1983,1,0,2023-07-25 08:28:40
I think good for her,Glidepath22,1,0,2023-07-25 08:33:22
Average at best. Not a complete misfire but definitely not great.,OnlyTheBLars89,1,0,2023-07-25 08:40:00
Natalie Dormer,10055682,1,0,2023-07-25 08:42:11
"🐐 level, don't let the Feige bots tell you otherwise.",DoktorStephenStrange,1,0,2023-07-25 08:54:34
I’m just glad some actors are refusing to waste their time on this crap. It’s gone on long enough. Plus she’s been in a so many comic book movies now. I’m sure she’s tired of it.,Pugilist12,1,0,2023-07-25 09:10:41
"Complete misfire.

I have nothing against Margot but hot take: personally I just don’t like her acting. I never liked her harley, and everything else I’ve seen her in has been pretty good movies but she’s easily the worst part. I don’t think she brings much of any range or nuance to her roles.",Markus2822,1,0,2023-07-25 09:18:31
Margot Robbie can do anything,CastorMorveer,1,0,2023-07-25 09:22:04
She’s boring as fuck. I don’t get the appeal. I get she’s good looking but we saw her a decade ago. Like we don’t need to keep looking at her.,ColleenNotALoser,1,0,2023-07-25 09:33:51
Mis,theliondsgn,1,0,2023-07-25 09:35:00
"Marvel needs to hire up-and-comers for these roles. Margot Robbie and Adam Driver are not up-and-comers, they’re established movie stars.",SafePlenty2590,1,0,2023-07-25 10:16:09
Would have been okay but she's far from the only one suited for the role. Frankly Sue Storm isn't a particularly complex character,Sentsuizan,1,0,2023-07-25 10:22:30
"I would’ve hated her as SS, I’m so tired of seeing her in movies now. Let someone else have a go for a while.",pleasegivemepatience,1,0,2023-07-25 10:45:48
Seems like screen rant banter,MetaManifold,1,0,2023-07-25 11:02:21
We don’t care for F4.  We just want an X-men movie,ModsR4Pussy,1,0,2023-07-25 11:18:54
"It would have been good because Margot Robbie herself is amazing in everything she does, even if the writing or film as a whole is shit.

That said, I’m not upset she tired it down.  There are plenty of other actors I think who will do just as good a job.",itscricket,1,0,2023-07-25 11:26:50
I would like to see it as a step back from oversaturation.  I am tired of certain actors.  Over exposure is a real thing and seeing them everywhere hurts their image to me personally and I tend to start to ignore what they are in and what they are promoting.  Even it is is not a movie.,Khadaji1028,1,0,2023-07-25 11:27:56
Average.,SlickSam87,1,0,2023-07-25 11:40:15
"I don't think it matters who plays her, it's not going to be great anyway.",Ok-Bench-180,1,0,2023-07-25 11:41:25
Her acting wouldve been good. The movie wouldve been bad.,Melbourneboy1,1,0,2023-07-25 11:45:53
She is way too famous for that dumpster fire.,Kitdivine,1,0,2023-07-25 12:29:38
It would’ve been amazing. Im sad she dropped out. Margot is a very capable actress. Alot of people say Sue may not suit her but I think she’d nail it.,TheJack0fDiamonds,1,0,2023-07-25 12:56:28
"It would’ve been the same generic cookie-cutter superhero schlock we’ve been getting since 2012, who cares",JulGabi,1,0,2023-07-25 12:58:35
Best career choice ever,r8jensen,1,0,2023-07-25 13:10:15
"She was a Misfire, I like Sarah Gadon or Amanda Seyfried but they may be too old. Maybe Lili Reinhart?",metronomemike,1,0,2023-07-25 13:14:27
She’s to old to play Sue Storm.,Jitterbug2018,1,0,2023-07-25 13:15:29
She’s be great in anything,gregieb429,1,0,2023-07-25 13:28:32
I’m just glad they were trying to get an actress that actually looks like the woman in the comics. It’s a breath of fresh air frankly….,TheOddFather5,1,0,2023-07-25 13:28:49
"Not true, they’re going to cast a relative unknown so they can tie them to a 10+ year contract and Robbie doesn’t need it, especially after Barbie’s box office",Acceptable_Bed280,1,0,2023-07-25 13:31:59
It would’ve been a mistake for her to take that role.,mydrunkuncle,1,0,2023-07-25 13:47:30
"But she’ll play toxic femdom Barbie….Honestly she’s not that great an actress anyway. If she wasn’t hot, she wouldn’t get casted.",LifandiMeme,1,0,2023-07-25 14:01:57
I don't think that someone can play Sue Storm just because is blonde. Maybe her character need a little bit of reinterpretation.,Travisb_4,1,0,2023-07-25 14:15:03
"She’s a great actress and would’ve done well with role. That being said I still felt the cast was a bit uninspired, “let’s get the most famous blonde actress right now to play sue”",Profx109,1,0,2023-07-25 14:29:58
"She has the range, but I would say it’s a miss.",Teschnerdy,1,0,2023-07-25 14:38:30
"I think she's overexposed at this point, in addition to not being a good fit. I did like the idea of John Krasinski as Mr. Fantastic though.",guyonlinepgh,1,0,2023-07-25 14:45:32
"She's been fantastic in a lot of things. She doesn't have to be in _everything_, though. Not a great fit for Sue.",AnEgoJabroni,1,0,2023-07-25 14:46:40
She would have been a bad cast for Sue. Just because she's blond doesnt mean she's immediately perfect for it.,Faiithe,1,0,2023-07-25 14:46:48
"I think it's not that she would be good or bad, it's that we need to just stop making cape movies.  Its like power rangers now.   Its not good anymore.",Firm_Spot6829,1,0,2023-07-25 14:48:22
