Comment_Body,Author,Upvotes,Awards,Date
She is wearing makeup! This is a natural makeup look. This guy doesn’t know what he is talking about.,BimboTwitchBarbie,10797,0,2023-07-13 01:31:55
His girlfriend is way hotter but we dont know her and she goes to another school.,TheGamingBear777,1379,0,2023-07-13 03:22:45
It’s crazy how many “alphas” are just totally disgusted by 99% of women. It’s almost like they don’t even like women,DogFacedManboy,1537,0,2023-07-13 03:49:35
"a) she's not ""mid""

b) she's wearing makeup in this picture",ejbrds,1190,0,2023-07-13 02:29:10
Then wtf isn’t mid,Ok-Ihatetiktoc,1027,0,2023-07-13 01:32:01
Guy probably gets hot over anime.,MissingMichigan,1221,0,2023-07-13 01:27:41
Why the hell do we repost these morons?,ATXDefenseAttorney,100,0,2023-07-13 02:41:32
She's wearing makeup in this picture,honestqbe,93,0,2023-07-13 04:49:04
"Considering Nick looks like the Beetlejuice shrunken head guy, he should avoid judgements.",JewelerHour3344,311,0,2023-07-13 02:34:44
Esp since she is wearing make up in that pic lol,ThroatEyeKnucklebone,108,0,2023-07-13 02:53:53
Meanwhile the guy looks like an NPC from Oblivion,Jetix4397,35,0,2023-07-13 05:11:14
Lmao she is wearing full make up and she’s using a ring light.,BalkanbaroqueBBQ,315,0,2023-07-13 01:34:19
People have forgotten what real humans look like without 2 lbs of contouring makeup and IG filters,JET1385,50,0,2023-07-13 06:10:47
I feel so old and uncultured. What is mid?,beekee404,54,0,2023-07-13 03:19:13
Attraction is highly subjective.  I don’t find her particularly attractive.  But I’m also not out here rating the looks of people and actively comparing people’s looks.,jhuseby,73,0,2023-07-13 04:04:26
"But opinions are like assholes or whatever, everyone has one. Who gives a shit.",Honer-Simpsom,59,0,2023-07-13 01:43:58
He looks like he has to introduce himself to his neighbors when he moves because he’s on a list,tcguy71,68,0,2023-07-13 02:54:00
She’s pretty and the Australian-ness alone adds like 4 points.,Decabet,128,0,2023-07-13 02:48:58
"I'm not saying she's unattractive, but she doesn't do it for me. At the same time she probably wouldn't find me some bang-average 30yo dude (me) all that attractive either. And that's fine.

We're all entitled to our own opinions, and that's also fine. What we shouldn't be doing is dragging folk down who have done nothing against us.

Plus as plenty have mentioned before me, there's definitely make-up on her face.",MRich92,44,0,2023-07-13 05:28:22
"I would fist myself in the ass to sleep with this “mid” woman. 

Guy must have some impossibly high standards he can never reach.",[deleted],180,0,2023-07-13 02:03:30
Calling her 'mid' while looking like that? okay. If photoshopped and heavy filtered cosplayer pics are your thing then go off,Ok_Square_2479,37,0,2023-07-13 03:28:56
Definitely wearing make up.,Holiday-Signature-33,8,0,2023-07-13 02:47:54
“Is she mid or are you addicted to porn?”,SarahTheFerret,50,0,2023-07-13 03:50:49
Anyone in a photo taken 20cm from their face can be called mid. The wide angle close up selfie shot is not flattering on anyone and doesn't represent how anyone actually looks. The person making that comment is **obviously** baiting and looking for an argument or angry replies.,Rip_ManaPot,9,0,2023-07-13 03:26:27
SHES STILL HOT- if this mid then i’m fucking hideous wtf,Lexi_501st,24,0,2023-07-13 03:21:45
TIL I'm lower mid or upper bottom at best.,Aggravating_Pepper23,7,0,2023-07-13 01:56:18
People too used to seeing people filtered and edited on instagram they forgot what people actually look like.,RomeoSki,7,0,2023-07-13 09:18:34
She is mid tho,CournelKeks,6,0,2023-07-13 09:39:07
A bit below average if you ask me,More_Equivalent1244,6,0,2023-07-13 09:39:25
"She's literally still wearing makeup tho. There's a difference between ""no makeup"" and a ""no makeup look""",Tamajyn,5,0,2023-07-13 10:42:58
">This is her without makeup.

Incorrect.

>Definitely mid. 

Nick, your head looks like a football.",cell_driving_car,7,0,2023-07-13 12:11:35
"Is this a joke? She's stunning, and more importantly, she seems lovely and is quite funny.",KindBikeDuck,63,0,2023-07-13 01:41:12
"When a guy calls a girl ""mid"" you just know exactly what kind of guy they are.",thisperson345,11,0,2023-07-13 09:38:25
"I mean, technically she is average. Most faces are. She has few blemishes, nothing unpleasant, nice eyes. But everything is pretty ordinary. Thats all it takes to be pretty with the aid of some makeup, which she is definitely wearing.",Smooth_Imagination,5,0,2023-07-13 10:54:48
"Not gonna lie she’s mid for me, I know I’ll get a lot of hate for that. Everyone has their preferences man and she’s not ticking many boxes for me. Even with a full face of makeup I don’t find her very attractive. To each their own, I don’t think this is a facepalm",Responsible_Art1400,79,0,2023-07-13 02:13:36
Pov you've never seen a woman without makeup,Dascoolman,9,0,2023-07-13 03:47:18
"I know I’m gonna get downvoted af for saying this but , to me , I’m a brown guy , she looks like any white woman i see that’s a little bit attractive , I.e mid . I mean she looked hot af on wolf of wall street but not much here . Now Ana De Armas , that’s a solid 10 , u know what maybe I’m just not that into blondes . Nvm .",Appropriate-Cut8001,14,0,2023-07-13 07:10:02
This dude would cream his Dickie’s if Margot fucking Robbie so much as looked his direction,JoMah87,6,0,2023-07-13 03:57:15
She's not even that attractive with make-up.,tarmagoyf,7,0,2023-07-13 05:40:42
The incel is strong with this one,Trumprapespeople,29,0,2023-07-13 02:53:42
Unlike Nick there who is a solid 3....,Thiccaca,6,0,2023-07-13 03:15:07
She’s wearing makeup moron,Apanda15,4,0,2023-07-13 03:32:06
Think my wife looks better :),Raamyr,5,0,2023-07-13 04:53:47
"She is wearing lipstick, mascara, foundation and blush",IrishRogue3,6,0,2023-07-13 05:21:56
Guys who says a woman like this isn’t good looking enough for them definitely doesn’t have a chance with women who looks half as good as her. Probably they have to pay in one way or another to get any attention from women at all.,No-Concert4588,4,0,2023-07-13 07:28:06
What is mid? whats is based? what is all this new age bullsh\*t?,Crunchynut007,4,0,2023-07-13 09:46:18
If that is no makeup than we've collectively lost the plot.,mideast0nblu,4,0,2023-07-13 11:29:37
People don't even seem to understand what women look like without filters or makeup anymore.,Original-Wing-7836,4,0,2023-07-13 12:56:18
Def still wearing make up,BetaRayBlu,4,0,2023-07-13 21:00:01
These kinds of posts are always from people objectively less attractive. Do they never look in a mirror or have their narcissist goggles on the whole time?,DiscombobulatedHat19,9,0,2023-07-13 03:45:53
"The dude aged like fine wine, and the fact that he didn't throw away his hobbies to become a miserable adult with no interests for the fuck of it is a good thing",Galvatrix,3331,1,2023-07-18 22:32:15
Well fuck that guy for getting older and liking stuff.,Bahmerman,6050,2,2023-07-18 22:04:56
Celebrities age. Got it.,SoylentGrunt,913,0,2023-07-18 21:33:55
Personally I find the right pic more attractive.,Ok-Scientist5524,215,0,2023-07-18 22:31:14
"Lol. Okayyyy lady. I'm a guy, and straight as an arrow,  and H.C. is gorgeous. His Geralt is full blown man crush material. 

Get yer head checked lady",TheOrangeKrunch721,1815,0,2023-07-18 21:46:14
"Creepy Weirdo Gamer?! Ex-fucking-cuse you, **I** am a creepy weirdo gamer. Henry Cavill is like the most well adjusted gamer out there. I would kill to be the type of gamer Henry Cavill is. Do not denegrate a man for his hobby, it's not like everybody into football is some sorta hooligan or everyone into horses is some entitled posh wanker.",Hawkeye2701,5280,4,2023-07-18 21:12:17
How dare he! To have hobbies and interests and feel comfortable talking about them with strangers! This monster is clearly unhinged and probably woke to boot!,MacSanchez,6544,0,2023-07-18 21:08:07
"There are straight men that wouldn't even hesitate to be with this guy, platonically or romantically. Dudes built like a Greek God.",Pentamachina3,1048,0,2023-07-18 21:36:12
Probably went to kindergarten with Henry and got dumped at the age of 5,DantheDutchGuy,582,0,2023-07-18 21:01:23
She’s talking shit. He could put his dick wherever he wanted in or on me and say thank you.,x_franki_berri_x,1224,0,2023-07-18 21:38:56
"Her username is literally “misandristLana”, and this is misandry. It does what it says on the can.",Jagasi,345,0,2023-07-18 23:17:01
Lol her account is suspended on Twitter.,Sinnsearachd,153,0,2023-07-18 22:43:51
"She is entitled to her opinion, but as her opinion is fucking stupid in going to ignore it",Smiling_Cannibal,46,0,2023-07-18 22:40:20
Mhmm. In Gerald’s voice,Affectionate-Net2277,45,0,2023-07-18 21:32:31
I would still rather look like him then 99% of the men on earth,blackzep1980,170,0,2023-07-18 21:06:58
"Shut Up, Lana 

Go to doctor. Your eyes are broken.",Starr-Bugg,62,0,2023-07-18 23:02:09
... Balding? She never seen widows peaks? That's not balding.,imaybeacatIRl,281,0,2023-07-18 21:41:13
Femcel shit for real. That man is gorgeous. My husband has developed this hairline as he has entered his mid-thirties and I think it’s hot af. Some people just don’t want anyone to be happy lol,turndownforwomp,201,0,2023-07-18 21:00:25
"![gif](giphy|gft2md5CulN04)

100% beef.",AloneAddiction,29,0,2023-07-18 23:42:50
"I'm a heterosexual male and I'm not sure I could push Cavill away if he made advances towards me, not that he would lol.",Frymanstbf,95,0,2023-07-18 22:12:56
"Apperently Henry doesn't use steroids as it is in the superman contract and he has great genetics and takes his shit seriously. Gaming is a healthy hobby especially with a man with a career. The man played a super hero and a fantasy story that was turned into video game protagonist and is working on a 40K series with Amazon. He almost missed his audition for superman because he's raiding in WoW.

HE HAS BEEN A NERD SINCE THE BEGINNING.",Sumthin_Ironic,298,0,2023-07-18 21:53:03
"Henry Cavill being a proud nerd makes him even more gorgeous, wtf is this skank smoking.",Fluffy_Two5110,23,0,2023-07-18 23:05:07
If Cavill is a weirdo creep gamer.. then.. what in the fuckin hills have eyes am I?,Kage9866,22,0,2023-07-18 23:45:17
I mean come on. I’m comfortable enough in my heterosexuality to say that dude is like the definition of handsome.,OutdatedElements,24,0,2023-07-18 23:48:10
"Henry Cavill had to ask for a rebook of his Superman audition cause he was to busy raiding on world of Warcraft. 

Then man was a nerd far before he bulked up.

Don't care if he is a roid junkie nerd. The man's passionate about his career. He's a damn good superman and he will always be the face of Geralt when I play the games and read the books.",fartboxco,33,0,2023-07-18 23:15:33
LMAO HER USERNAME CHECKS OUT. Girly is just jealous no man would look at her 💀,Busy_Beat_2632,59,0,2023-07-18 21:13:19
"I mean, people have their tastes, but this woman’s delusional.",M-Kawai,29,0,2023-07-18 21:15:30
God I want that man to do unspeakable things to me.,AReallyAsianName,14,0,2023-07-19 00:36:55
Wow Lana is a piece of shit,Raecino,12,0,2023-07-18 22:49:53
"Folks, her @ is *literally* **Misandrist**lana. She's telling you upfront her take is rooted in either trolling or hate.",Artyom21,10,0,2023-07-19 01:18:09
"“Creepy weirdo gamer” 

If anything, him being a gamer and such a nerd makes him even cooler in my book",RockNRoll85,19,0,2023-07-18 22:33:52
He’s not only easy on the eyes but very smart and funny. I love the fact that he plays video games and he is a nerd in real life. What’s not to love lol,Chaoticmindsoftheart,9,0,2023-07-18 23:50:57
I think he is hotter now.... like a fine wine.,aimeec3,16,0,2023-07-18 22:19:53
"As a straight man with a wife:

Henry Cavill gets sexier every day.",jdehjdeh,7,0,2023-07-18 23:15:49
"It’s almost as if Cavill is… (pause for effect) *aging*, as if years have passed?",ixnine,7,0,2023-07-19 01:21:14
Henry Cavill is so handsome that I’d choose him over the vast majority of women and I’m a straight dude.  ”Lana” is frickin’ deluded.,I_Framed_OJ,7,0,2023-07-19 00:39:11
I'm a full blown dude and that man has aged like a fine wine.,TheSolMan,7,0,2023-07-19 00:49:15
Henry cavill is so handsome most dudes would likely want to fuck him,Giftfri,8,0,2023-07-19 01:21:49
"Creepy Wierdo gamer is such a weird thing to say. It’s one of the biggest entertainment industries in the world and is Extremely mainstream. It’s basically like saying to someone “ewwww, you like to watch movies?! Gross”",CrazySDBass,12,0,2023-07-18 23:02:49
Crazy,jesschicken12,5,0,2023-07-18 21:25:52
Just another idiot with an opinion.,RockyMtnOysterCo,6,0,2023-07-18 22:34:41
"...Is he supposed to be ""ugly"" in one of these pics? Because both of these versions of Henry Cavill can get it.",flooperdooper4,6,0,2023-07-18 22:37:35
Man gets shamed for aging and having a hobby. What's wrong with people lol,burgerman000,6,0,2023-07-19 07:05:23
Her @ is misandristLana…,Jack-Herer97,20,0,2023-07-18 21:52:08
Talking about his hairline like she never heard of a barber before to keep his hairline cleaned up 😩,Zendtri,4,0,2023-07-18 22:18:49
Ok but does anyone remember the post where a woman stated people told her she looked like Margot Robbie and she was leaving her husband to be a actress in her mid 40s? That’s all I think about when I hear her name,Peppawhatareyoudoin8,4,0,2023-07-18 22:26:19
I’m a straight ass dude and I would let Henry use my body to whatever desire he is wanted. I’d be so proud.,bakedgamerboi,6,0,2023-07-18 23:00:20
"I'm a straight dude, but I wouldnt kick him out of bed for eating crackers and leaving crumbs.",mogley19922,5,0,2023-07-18 23:05:06
"Can you believe the nerve of this man taking time to do what he enjoys? And don't even get me started on the absolute gumption this man has to fucking age. 

Idiot out here talking like he didn't age like fine wine. So far at least.",Sanguiniutron,5,0,2023-07-18 23:51:13
Pro Tip: Lana isnt real,hank-particles-pym,3,0,2023-07-19 00:25:34
Gay man here - I find Cavill scrumptious and his appreciation of 40k an immediate plus.,Training-Meal-4276,6,0,2023-07-19 01:14:15
"Shit, I’m not gay but he’s handsome IMO",rell7thirty,6,0,2023-07-19 01:30:48
"I think Lana is blind, because if she looked in a mirror she would see the spitting image of the late Michael Jackson.",Capt_Destro,6,0,2023-07-19 02:47:53
Like this girl can land a Cavil. She be lucky if she can land a Bob from Accounting,jab090285,5,0,2023-07-19 06:06:06
"If Henry cavill isn't hot, no man will ever be",Roffolo,5,0,2023-07-19 06:33:54
"""misandrist lana"" Femcels are a thing.",Rognol,5,0,2023-07-19 06:41:03
This cultures obsession with youth is so fucking weird.,Robotonist,5,0,2023-07-19 07:05:16
"Body ruined by steroids? Cavill has been in shape from a very early age and his physique is very attainable naturally. He was never one of those guys who ""got fit for a role"".",nethereus,12,0,2023-07-18 22:51:35
"This man ages like a fine wine, they obviously have no taste. He’s passionate about his interests and talks about them 😱, what a weirdo 🙄",Less_Ad5978,3,0,2023-07-18 22:21:16
"She’s mad cause he is the most real actor, he actually feels like a normal man",Random-guy-as-vecna,3,0,2023-07-18 22:35:06
"Look at that deformed freak on the right. The picture of true hideousness. A visage that only inspires disgust. I truly don’t even understand how people can bare to look 

^/s",Shenanigans80h,4,0,2023-07-18 22:37:00
I still love how they tried to say he used toxic gamer language on set of the Witcher. What a funny joke.,Androza23,3,0,2023-07-18 22:38:09
"what does creepy weirdo gamer even mean, it's like she's implying touching a video game at all makes you creepy and weird or something",AverageRdtUser,5,0,2023-07-18 22:52:31
[deleted],[deleted],4,0,2023-07-18 22:54:24
#Heresy!,Zxxzzzzx,3,0,2023-07-18 22:58:24
"In other words, he's not an older teen-early 20s and she doesn't find him attractive anymore. That's fine; we grownup, adult, mature women who know what to do with a man will be happy to take it from here.",MinxTheCat1019,4,0,2023-07-18 23:03:31
"Can we just settle for saying that the people who called Margot Robbie ""mid"" were stupid and leave it at that? 

No need to attack other people who didn't get involved. 
Henry Calvin's still fine asf! Leave him alone!",Available-Cobbler-10,4,0,2023-07-19 01:31:05
"why are people so disgusted by age, of course he doesn’t have youthful exuberance anymore, he’s not 20.",ChaTae95,4,0,2023-07-19 01:33:26
"So she learned he loves video games, and now he's a hideous creep. I'll never understand why so many people think it's just unacceptable to play games. Compared to just watching TV it's actually beneficial and you get to be part of a story rather than just watching it",GraveyardJones,4,0,2023-07-19 01:36:22
"Hi, I, a married (to a man) 37F am also a gamer and even though my husband and I are both straight as a 2x4 I would hit that in a second and so would he.",LordOscarthePurr,4,0,2023-07-19 01:41:01
Quite possibly the worst take I’ve ever seen. Henry Cavill only got more attractive in talking about his hobbies. How can you see someone talking passionately about something they get immense enjoyment from and think it’s unattractive in any way? Let alone Henry Cavill.,Hopelessly_Hopefool,3,0,2023-07-19 02:39:04
"Yeah ok, him being a weirdo gamer is what makes me wanna lick him clean. Gtfo.",TerribleLifeExp,5,0,2023-07-19 02:47:07
Her username definitely checks out 😳,Independent_Cookie,5,0,2023-07-19 02:48:39
"He looks like my partner
(My partner is very far out of my league)",elzpwetd,5,0,2023-07-19 03:37:59
"With a name like ""misandristlana"" I would not expect any kind of intelligent or even slightly logical sentence from them",Reyfer01,4,0,2023-07-19 04:27:19
How dare he age and have hobbies!!!,goufish1985,5,0,2023-07-19 06:29:12
"I love those clips of him doing interviews with women grinning from ear to ear, then he starts talking about video games and they start pouting",like3000people,3,0,2023-07-19 07:06:40
Steroids? He isn't THAT big...,Salt_E_Dawg,7,0,2023-07-18 22:30:05
Lana spelled backwards is anal. Just sayin'.,baginahuge,8,0,2023-07-18 22:08:14
"Gonna be honest, even at his hottest he was never even mid to me. Seems a nice enough guy though...",Cruzin2fold,8,0,2023-07-18 22:43:26
"wait, people are calling margot robbie mid?? wtf?",big_hungry_joe,12,0,2023-07-18 23:05:39
Bros handsome af idc,Thin_Relief_3953,3,0,2023-07-18 22:23:43
At least she isn't talking shit about Danny Devitto.,Zardhas,3,0,2023-07-18 22:37:21
I married a weird gamer. They're awesome,mrmeeseekslifeispain,3,0,2023-07-18 22:39:04
Lana is insecure about her own image. This is why she feels the need to put an absolute stud down.,TopperTS13,3,0,2023-07-18 22:39:26
"Damn. Guess I better not age and go from super hot to mid. Or in my case, mid to mid-life crisis.",CrieDeCoeur,3,0,2023-07-18 22:57:34
I could sell a kidney to have henry looking at me for a split second,Fahggy1410,3,0,2023-07-18 22:57:59
"Henry Cavil is my man crush, and she can keep her opinion to herself",AfterGilgamesh,3,0,2023-07-18 23:05:25
She just found out he likes games and changed her whole perception of him 💀,MostlyAnxiety,3,0,2023-07-18 23:41:12
"Y'all can lie to yourselves all you want, but my bisexual ass would be DELIGHTED to be beaten up by either Margot or Henry. Thank you very much! 😤",rosiestinkie9,3,0,2023-07-18 23:42:12
I’m a lesbian but for what it’s worth he’s a knockout. In both instances.,PavlichenkosGhost,3,0,2023-07-18 23:56:43
I think he’s better looking now than younger years,Playwitbe4,3,0,2023-07-19 00:37:36
Man how do I ruin my body like Henry Cavill?,FlatTopTonysCanoe,3,0,2023-07-19 00:37:40
he got sexier,metallic__blood,3,0,2023-07-19 00:38:02
"He still hot af, and I’d shack up with that weirdo gamer anyday! Haha",mizzkrose,3,0,2023-07-19 00:38:18
That’s fine. More daddy Cavil for me. We can paint minis and play on PCs as we grow old.,chychy94,3,0,2023-07-19 00:39:40
"Anyone remember the gal who wrote for a nerd website that then broke up with a guy when she found out he played Magic: The Gathering? Then she expected the readers to be on her side and not the tournament level player who was also successful in his day job. Yeah this is the new version of that trash fire.

Fount it: https://gizmodo.com/my-brief-okcupid-affair-with-a-world-champion-magic-th-5833787",Dr_J_Hyde,3,0,2023-07-19 00:48:18
She got some hot takes for someone whose last name backwards is ANAL.,PanzerBiscuit,3,0,2023-07-19 01:21:35
"If I had movie star money, I too could have my verbal diarrhea screenshotted and posted to other social media sites.",Alt-Tabris,3,0,2023-07-19 01:30:37
Am I… the only one who finds him more attractive on the right than on the left? Maybe I’m fucking crazy but… facial hair suits him.,ShieldSister27,3,0,2023-07-19 01:31:44
He literally looks the same. Lana is on some strong shit.,totallynotarobut,3,0,2023-07-19 01:34:06
Margot Robbie is mid though 🤷‍♂️,CanadianEH86,3,0,2023-07-19 01:35:39
Every straight man is gay for two men - Henry Cavill and Ryan Reynolds.,GachaHell720,3,0,2023-07-19 01:41:11
Lana you do realize you will age also and so will your attractiveness? You will probably look like a wrinkled old prune as you concentrate too much on appearances. He looks fine to me.,whyohwhythis,3,0,2023-07-19 02:35:54
"She does call herself a misandrist, so she’s openly a shitty bigot who deserves to be shunned by decent people, in the same way misogynists and racists are.",ajkclay05,3,0,2023-07-19 02:37:04
I have a feeling Henry could care less,CitizenKing1001,3,0,2023-07-19 02:38:41
"Creepy weirdo gamer in a time where practically everyone, including old women, play games...and shitting on someone for their hair style and natural hairline while she's wearing 10 layers of makeup, working her lighting, angles and posting selfies online like a narcissistic twat. Amazing.",iSOBigD,3,0,2023-07-19 02:38:47
This was probably the show runner for the witchers burner account,Andy-Is-Hot,3,0,2023-07-19 02:39:34
I know so many men and women that would happily climb Henry Cavill like a mountain to conquer him. Lil Ms. Criticism is bananas.,AnyAssumption4707,3,0,2023-07-19 02:41:57
Lauren Hissrich’s burner acc be like,Significant_Dog_6481,3,0,2023-07-19 02:51:41
"Bruh if this dude ugly, Im fucked",KingChimichanga,3,0,2023-07-19 03:08:22
Some people are delusional what can you do,darkspace69,3,0,2023-07-19 03:40:19
"I appreciated HC's looks before. I thought ""yes. He's very physically appealing, like 99% of Hollywood A-listers."" bit thought no more of him than other incredibly physically attractive stars. 

Then I saw a video of him super excitedly building a new PC. So excited he installed the heat sink upside down and didn't realize it until after he edited the video. And then I saw videos of him painting his Warhammer figurines, and just being a giant unashamed geek about it all. 

And now I love him. And I know that he will age. He will change. And I will continue to love that geeky gorgeous man. BECAUSE he's completely unashamed to show his non-mainstream hobbies. 

Also, I will absolutely watch the Warhammer stuff he's working on.",Azhchay,3,0,2023-07-19 03:46:06
what. lot of straight men willing to go gay for him.,ikankecil,3,0,2023-07-19 04:32:06
"Cavill, the guy who never uses steroids.. ok",CALlCO,3,0,2023-07-19 06:14:02
"…you can have preferences, but shaming someone so hard over your own preferences? Kinda low, kinda lame. Also, yeah, people age. People bald, dunno about the steroid thing, and people have hobbies. What the deuce, man. You can have preferences, but don’t shame people cause they don’t fit them.",No-Insect-7544,3,0,2023-07-19 07:03:57
"Proof that no matter how attractive you are, people will discriminate against you for being a gamer😞

It is time for the Gamers to Rise Up! ✊🤡",dead_radio_star,3,0,2023-07-19 07:04:08
"No need to insult the guy, you just prefer someone with a more youthful face.

Plenty still find men attractive, sometimes even more so as they grow older.

Your experience isn’t the same as everyone else’s experience and that’s okay.",InfinteAbyss,3,0,2023-07-19 07:04:24
He's definitely attractive but everyone is bashing Leo for dating younger girls (deservedly so) but somehow everyone turns a blind eye on Henry Cavill doing the same. That's weird.,Aggravating_Bad5004,3,0,2023-07-19 10:44:56
"Love it when folks equit being a gamer to being a weirdo. 

It's a great litmus test for finding the most basic among us.",cassarlex,3,0,2023-07-19 16:26:58
"She describes herself as a misandrist, so this is just on-brand and what we should expect on that cesspool of a social network. She's either an idiot or a troll, and either way we should not be wasting our time with her antics.",robilar,5,0,2023-07-18 23:01:17
She cares about celebrities.tells me enough.,zerot0n1n,4,0,2023-07-18 21:39:36
"That's just a high widows peak. I have one as well. At times I have to make sure I am not balding because I get paranoid, but over the last 5 years or so of double checking and it hasn't changed yet.",droombie55,5,0,2023-07-18 21:53:39
![gif](giphy|IgpA68x7IJdVvtkNTM),Alivethroughempathy,3,0,2023-07-18 22:56:34
Bald men are still hot... especially with facial hair.,JesusHHChrist,4,0,2023-07-18 22:11:42
My God if I looked anything remotely close to that guy I would get more ass than a toilet seat...,HollywoodBret,7,0,2023-07-19 00:35:13
He doesn’t use steroids.,hotdogsandhandsoap,4,0,2023-07-18 21:50:53
