Comment_Body,Author,Upvotes,Awards,Date
"Damn she's stunning.. Smart, beautiful, and talented is a crazy combo",NAS210,2,0,2023-07-25 04:23:50
"I think she’s doing the alphabet in Australian sign language? In the back of my public primary school diary they had instructions on how to sign the alphabet, count and a couple of other common signs. I can still sign alphabet after 20 years because of that diary.",Flintelbowpatches,2,0,2023-07-25 04:29:33
"Stop shitting on someone for being able to connect. Don't know many people who can sign, nor who have even bothered to learn it.",bigorangefuzzy,2,0,2023-07-25 04:33:40
Oh I love her.,SaintlyBrew,2,0,2023-07-25 04:54:37
Not hearing impaired. The term they use is deaf or hard of hearing.,throwaway4537944,2,0,2023-07-25 05:06:40
She’s amazing 😻,Improvgal,2,0,2023-07-25 05:10:25
"The amount of effort it takes to become proficient is astonishing, the more I learn about her makes me like her more and more as a human being.",Srawesomekickass,2,0,2023-07-25 05:11:26
"“Margot! Margot!”

Can you stfu for a sec?",alittle2high,2,0,2023-07-25 05:17:16
The gal can do it ALL!!!!!,JpnDude,2,0,2023-07-25 05:18:53
I wish someone had told that annoying pos that kept calling her name to shut the eff up.,SoyEseVato,2,0,2023-07-25 05:24:29
"That is cool!! I always considered Margot to be an OK actress, but this moved her to the top of the list of my best person list.",siddarthshekar,2,0,2023-07-25 05:32:32
Is she becoming a new Keanu?,This_n_that01,2,0,2023-07-25 05:33:56
"Impatient child, calm down.",Givemelifebro,2,0,2023-07-25 05:35:06
Signing Barbie. So pretty!!,kakebabe8,2,0,2023-07-25 05:47:26
What a fucking sweetheart,Plenty-Estate-1422,2,0,2023-07-25 05:49:24
That might be the most actually wholesome thing I’ve seen a big celebrity do genuinely.,Cannial,2,0,2023-07-25 06:18:08
"Margo……….Margo…Margo….Margo….look me please….Margo……Margo

Dude stfu",Annahsbananas,2,0,2023-07-25 06:48:46
"She seems like such a lovely person, beauty is only one of her amazing qualities. Kind, excellent at acting. I’m a straight female, but I can totally see why she’s considered the full package.",beautifullogic,2,0,2023-07-25 06:49:44
Margot! Margot! Margot! Margot!,Striped_Parsnip,2,0,2023-07-25 06:50:15
"When your think you can't love this woman more, she amazes you with her hidden talents - she is truely in line with Keanu and Ryan and all those down to earth actors. Incredible!",IloveElsaofArendelle,2,0,2023-07-25 06:57:43
Wow shitty camera man and also whoever that person who keeps saying her name is also annoying asf. At least it seems wholesome from their perspective,druman22,2,0,2023-07-25 06:57:44
"Wow, I am so blown away. What an amazing person. 👏🏻",Disastrous-Bat-7311,2,0,2023-07-25 07:06:45
What an absolute Chadette.,apathetic-fallacy,2,0,2023-07-25 07:59:35
I didn’t know she could sign. That’s dope.,ObvsThrowaway5120,2,0,2023-07-25 08:03:49
"How rude is that paparazzi man.

""Margot, Margot, Margot, Margot"" ""Margot, Margot look this way!""  ""Margot, Margot look this way!""   ""Margot, Margot look this way!""  ""Margot, Margot look this way!""  ""Margot, Margot look this way!""  ""Margot, Margot look this way!""  ""Margot, Margot look this way!""  ""Margot, Margot look this way!""  ""Margot, Margot look this way!""

OMG! How annoying!  : o

Bravo, Margot!!!",Ecstatic-Mongoose454,2,0,2023-07-25 08:05:31
"I want to know what language she is signing.

Is it American sign language?
Australian sign language?
English sign language?

And yes all 3 are different",lastingdreamsof,2,0,2023-07-25 08:27:41
"The dude yelling, ""Margot! Margot!"" needs to shut up. Paparazzi are pure scum.",DouceintheHouse,2,0,2023-07-25 08:55:31
I love how you can talk she’s really trying to converse with them 🥰 she’s so precious,Common_Match1454,2,0,2023-07-25 08:56:54
Okay genuine respect,brodibs327288,2,0,2023-07-25 09:15:57
That's a reason why she is a great celebrity,Davis_Johnsn,2,0,2023-07-25 09:21:07
Why did I turn the volume on ?,ByeLizardScum,2,0,2023-07-25 09:24:40
"Sign language should be taught to everyone, there are no negative reasons not to, the advantages are massive.",Arti-Stim,2,0,2023-07-25 09:28:15
"man if you grew up to become a paparazi, i hope you hate your life",wellmaybe_,2,0,2023-07-25 09:28:36
"Paparazzi, they must the most tone deaf people in existence.",Vicxas,2,0,2023-07-25 09:28:45
I watch everything on mute by default. (I’m HoH.) The comments had me confused for a while.,kimchipeanut,2,0,2023-07-25 09:56:21
When I thought she couldn't possibly get sexier... She goes and does this,Tevakh2312,2,0,2023-07-25 09:58:10
"As a deaf person that knows ASL, I swear it's more rare than Cherokee. I can never find anyone that uses it. Then again, I do live in the 'burbs.",Storm_Song,2,0,2023-07-25 10:01:41
"Margo, Marrgoo, MargO bro stfu",t7Saitama,2,0,2023-07-25 10:21:17
Just when I thought I couldn't be more of a fan! Man I love that chick...,Stepnwolfe,2,0,2023-07-25 10:58:50
Wow as a deaf guy I didn't think a perfect 10 could gain another point on the scale.,deanisforawesome,2,0,2023-07-25 11:01:11
Now that was unexpected and awesome.,TMQ73,2,0,2023-07-25 11:05:51
That photographer was one of those kids who always interrupted grown folk’s conversations,TheKwyetRoom,2,0,2023-07-25 11:06:41
"I came across a post on twitter today of a man complaining that Margot wasn't ""pretty enough"" and was ""pass her prime"". They basically hate the movie because it didn't give them a bouncy 18 year old for them to salivate over.",ElvishGuardian,1372,0,2023-07-20 17:38:25
I'm kind of surprised that all of these men are complaining about the Barbie movie like they were hardcore Barbie fans before.,Cthulhu625,802,0,2023-07-20 18:23:25
"I loved promising young woman. I had no idea she had anything to do with that movie. A man’s reaction to that movie is very revealing for good or bad. It’s very telling.

Also the fact that she is really hot makes them hate her for her strength even more. She confuses these sad little men.

Luckily the hate for her isn’t too widespread. I had no idea it was going on till I read this post",Armynap,210,0,2023-07-20 18:13:24
"She’s gorgeous, talented, and rich. She’s so far out of their league they have to perform mental contortions to bring her down, just to make themselves feel better. It’s pathetic.",birdlawprofessor,996,0,2023-07-20 18:06:48
"She's too beautiful, too able to have her own voice, and not waiting on them or their opinions. 

She's got to be ""brought down"", because a woman actually being that good, and that gorgeous, and not under a man's thumb? (Especially not under their thumb?) Getting above herself. 

It's misogyny, but through the lens of a woman who really does appear to be *that* good. She's very talented, interesting and interested in other people, and these guys can't cope.",humanhedgehog,76,0,2023-07-20 19:10:02
They don't like feminism. They liked her as the powerless wife in wolf of Wallstreet tho,Ecstatic-Status9352,260,0,2023-07-20 16:55:50
"I think this was even Promising Young Women. Started before that. Margot Robbie reclaimed Harley Quinn -- from the manic-pixie who worshiped Joker's cruelty, toxicity and emotional terrorism of her and hyper-sexualized nympho -- and there are a huge number of millennial men who will never forgive her for HQ becoming a full, super-cool human being independent of her abuser. 

Plus there is this huge group of bitter men online that don't like that women *like* things, have full vivid internal lives, with formative experiences and fandoms from childhood to adulthood, and have real economic and cultural power now. They used to be able to gatekeep us out of their ""real fandoms"", but that is getting a bit less effective lately, so they need to burn down anything that sniffs of serious fandom or nostalgia and doesn't service them and only them",MLeek,536,1,2023-07-20 16:48:26
"*checks notes*

The patriarchy.

No but seriously, this article argues it really well (I think it’s free???): https://www.theguardian.com/commentisfree/2023/jul/20/barbie-movie-republicans-reaction?CMP=Share_iOSApp_Other.

Tl;dr, most men are raised to view women as care and sex robots, so a movie about women’s empowerment premised on their humanity and right to self-determination is going to annoy a lot of them.",Elsierror,484,0,2023-07-20 17:41:31
Because toxic men can’t handle the fact that a Barbie movie might be actually a good movie.,stalewhiteclaw,39,0,2023-07-20 18:21:21
"She's a gorgeous, talented woman. Of course jealous, bitter men will hate her.

It's what jealous, bitter men do.",Jay2Jee,36,0,2023-07-20 19:01:25
"I gotta be honest, it’s making me want to see the Barbie movie now, and that would have *never* crossed my mind otherwise. 

I wasn’t a hard-core Barbie fan as a kid, I had a few, like most little girls. But really, I should give Barbie a whole lot more credit. She knew exactly who I was before it truly dawned on me later in life. In a “funny because it’s totally true (and how the fuck did I not see this?)“ way…when I built my little Barbie houses from boxes and scarves and such…my Barbie lived alone. She always had a chess board as a dance floor in her party room, and when she got home from her Jetset Business Barbie travels, she’d throw parties and have all her friends over…you know, the whole Strawberry Shortcake gang, some Smurfs, etc. The key thing was that *Ken never lived there*. He came over for her parties or a date night sleepover and then *went the fuck home*. They weren’t going to get married or have a little baby Barbies, things were the way they were going to be forever and her house would always be just her. That’s how she liked it. 

If 22, 28, or 33yo me knew myself half as well as 8yo me already did, I really could have saved myself a lot of time in life figuring shit out the hard way. 🤣",Sheila_Monarch,38,0,2023-07-20 19:04:14
I thought Carey Mulligan was just fine in Promising Young Woman.,factoryteamgair,64,0,2023-07-20 17:29:01
My take away from this whole situation is that the Barbie movie is really smart and modern.,Glad_Scheme_4035,36,0,2023-07-20 18:23:57
She’s a beautiful ADULT woman who doesn’t give a single fuck about appealing men. They wanted some 21 year old airhead to play Barbie instead of her.,pomskeet,32,0,2023-07-20 19:47:56
"I posted about this recently

Men have been the same from the time I was little

It doesn’t matter how perfect or flawless the woman is. They will make a point to underrate her

Men see women as narcissists basking in male attention all the time. They like to sow insecurity

Eta cuz I was multitasking

Same reason they make a big show of talking down models or other celebrities when they weigh 500 lbs and stink. It’s a coping mechanism. He would never have a shot with that woman anyway so he can look like he’s totally not like the other simps by “rejecting” her first

Some will also do something similar where they casually mention how they just “Don’t really find models/celebs that attractive” or” so n so is too skinny” not necessarily because it’s true (and sometimes it is) but because they’re hoping to appeal to the insecurities of women within earshot “oh he might appreciate my belly” you get the idea

The root is. They’re insecure. They can’t have her or anyone near her league. So sour grapes. You’ve seen I’m sure how many women are afraid to be openly honest that they find themselves attractive because there’s an army of insecure men and women lining up to tell them they’re ugly just because they hate seeing pretty people be aware of their prettiness and also again, because they want to drop people’s egos",[deleted],89,0,2023-07-20 18:45:22
They've transferred their misogyny from Bree Larson to Margot Robbie.,notorious98,139,0,2023-07-20 17:35:56
"Apparently just making a fun movie about a childhood icon is enough to send miserable no-lifes into a rage.

Seriously, anyone criticizing a movie that is purely and only quite clearly for entertainment and fun purposes needs to leave their mom's basement and cheeto dust and go outside and touch grass for a moment. 

The hatred is because how dare Hollywood make something that women and girls might like!!!!",Impossible_Path4827,23,0,2023-07-20 18:47:39
"They're just trying to neg her through the screen.

 Seeing a hot woman they have no chance with? She's not that hot anyway....

Or it's the attitude of this woman is getting too much attention and needs to be put back in her place.",Zoiddburger,20,0,2023-07-20 19:21:00
I don’t get. I think she is a total smoke show. Maybe its the talk shit about someone you could never get a date with thing?,Minqua,71,0,2023-07-20 16:18:31
Sounds like they are just mad they don't get to be Ken.,amence,18,0,2023-07-20 18:29:34
Some men feel a need to justify their hatred of women.,one_bean_hahahaha,18,0,2023-07-20 19:21:14
"Because a movie about a woman, made by a woman, based on a product aimed at girls is about to be wildly successful. And that just does not jibe with the neckbeard worldview.",action__andy,18,0,2023-07-20 21:37:57
It was Carey Mulligan in Promising Young woman,glitterinmytears,40,0,2023-07-20 16:40:21
My mom said Margot Robbie was too old to play Barbie and I was like what?! it's not just misogynistic men but also misogynistic women who are mad about it. It's INSANE to me bc she's only 33... I'm not even that far from her age bc I'm 28 so I'll be a hag in my moms eyes I'm just a few years 🙄,Southern_Level5036,14,0,2023-07-20 21:14:22
"They hate it because it wasn't made for them. 

Anything deemed ""girly"" is regularly shit on by toxic men as being inferior in some way, because we aren't allowed to experience any joy unless it relates to men.",tinydeelee,12,0,2023-07-20 20:26:54
"They can’t accept women age and grow up and look different, if she still looked like she did in Wolf of Wall Street they wouldn’t be upset",KingExplorer,24,0,2023-07-20 17:36:32
"Barbie and Robbie do not need a man around. Barbie has always had careers, her own homes, cars, anything and everything while Ken is an accessory. It drives the misogynists crazy that this movie has her as the powerhouse and Ken as the trophy-boy. I had no interest in this movie at first, but now I can't wait to go see it. I might even wear hot pink. Eff those jerks.",KalliMae,23,0,2023-07-20 20:05:33
"It's being hailed by the right as Woke Propaganda. I don't think the negative reviews were from men, they were from *republican* men.",iPinch89,11,0,2023-07-20 21:11:40
"Like 95% of men think Margot Robbie is a 10/10 stunner and I guarantee you men are going to this barbie movie JUST because she is in it.  


Me, I'm men. 

The internet is not real life.",quantumpencil,9,0,2023-07-20 22:30:24
"Hell most of them probably don't actually  know. Some sources they read on Instagram, Twitter etc.  said they should dislike something or someone, so they do.",erc_82,19,0,2023-07-20 18:06:14
"Misogynistic ageism, especially given she has a lot of say over her roles and thus isn't subject to being reduced to being only sexualised in her roles by male directors",InternationalPeak459,9,0,2023-07-20 20:57:38
"I initially had no interest in the Barbie movie, but if men are whining about it this much, it must be worth a watch.",Chocoholic42,10,0,2023-07-21 00:30:27
Men will review bomb media that women like.,Funny-Plantain3647,9,0,2023-07-20 18:55:42
They're mad that there's a movie that's popular that's not marketed towards them,strangelyahuman,7,0,2023-07-20 23:40:19
She looks her age. These idiots get angry when women show signs of aging but still are considered beautiful. They want older women to disappear.,ILoveCheetos85,13,0,2023-07-20 22:44:09
"Because, men can't handle that a woman is just doing better than them. They think we should be in the 1700s and not be able to do anything other than be their moms and give birth.",Farnese-de-Vandimion,13,0,2023-07-20 21:20:21
"No idea.  I’ve never been into Barbie but there’s no reason to make a stink about Robbie either way.  

I found her appealingly crazy as Harley Quinn in the Suicide Squad.  She seemed to revel in HQ’s weirdness as an adrenaline junkie turned on by violence and in a way made the character much more believable than Harley Quinn=Joker’s Doormat Without A Reason.",DConstructed,8,0,2023-07-20 19:00:24
"Oh, because she would never fuck them in a million years and they know it.",theycallmewinning,6,0,2023-07-20 20:08:16
"Same reason dipshits would screech about Brie Larson for like 5 years straight even though she's literally never done anything to upset them.

No particular reason, they just hate a movie about a woman, like Captain Marvel or Ghostbusters 2016.",SarcasticPedant,7,0,2023-07-20 20:49:29
"Dudes are mad about Margot? Everyone I've talked to agrees she's a brilliant actor who elevates every film she's in.

Side note, ""Mad About Margot"" should be the title to something",caznosaur2,11,0,2023-07-20 20:42:29
"I actually like Margot Robbie, she's a great actress with a wide range. She talented and has been getting better still.",Jamesyoder14,5,0,2023-07-20 19:32:36
"Oh shit, for months i thought the Barbie actress was the same one from My Name Is Earl. 

I did a quick google because of this post and TIL Margot Robbie and Jamie Pressley are not the same person! 

Both women are still utterly gorgeous though and i can only assume the hate for Margot Robbie is from angry incels that hate women in general.",birbscape90,5,0,2023-07-20 19:42:25
Cause she is beautiful and successful. I’ve seen incels on twitter mentioning how she is an average looking woman. I’ve seen them hating on Zendaya too and how a random McDonald’s cashier is more beautiful than her. They’re pathetic.,homogenic-,9,0,2023-07-21 00:41:13
"Pfft, these guys haven't seen Promising Young Woman. They just hate women.",Freecelebritypics,5,0,2023-07-20 19:24:27
"I love the way I look and wouldn’t want to trade places with very many people, but I’d do a face/body swap with Margo Robbie any day of the week, she’s gorgeous. Anyone saying otherwise is either blind or insane. I think men/boys have gotten the wrong idea from porn/anime/etc that all women should look filtered and digitized in real life, probably because so many of them are porn addicts and don’t leave their mothers basements enough to know what real women actually look like.",KlosterToGod,3,0,2023-07-20 19:57:53
"When these men pull out their childhood Barbies, they play with them differently. So the adjustment is hard.",formerly_gruntled,5,0,2023-07-20 22:35:54
Because she plays roles that they desperately want to fetishize and she makes it incredibly difficult for them to do that.,Dharmaqueen815,4,0,2023-07-20 22:53:04
Because there are a huge number of misogynistic a**holes on this site.  Barbie is a female driven movie and so these incels cannot let it go that it is well done.,noahbudie,3,0,2023-07-20 23:15:24
She's in a film and the film isn't aimed at them.,Dedj_McDedjson,3,0,2023-07-21 01:59:07
"I think a big part of it is her positions on films beyond roles she plays on screen. She gives a lot of hard hitting interviews, she expresses progressive opinions, she gets credit for films she largely creates instead of the credits going to industry-established men, when she does play sexualized roles she doesn’t focus on that in a bubbly surface level way and instead focuses on the role. Basically, she’s always gotten a lot of shit for having the audacity to be a complex and independent woman in the film industry beyond a sex object.",Afraid_of_Okapi,8,0,2023-07-20 22:44:42
"It stems from misogyny, silly 😀",masterofn0n3,10,0,2023-07-20 18:06:09
"She said something vaguely lefty, didn't she?",LunarCycleKat,3,0,2023-07-20 18:39:05
Mattel made the film. They may be framed as the antagonist but they approved and are profiting off the whole thing. I’m very excited for Barbie but the “commercial” aspect of it does concern me.,JayBone_Capone,3,0,2023-07-20 20:41:47
"I don't think there's a more accurate explanation than:

""Haters gonna hate"" lol",Galladorn,3,0,2023-07-20 21:04:22
"They are? Most people seem to love her. The men hating on her are mad that there's a successful, beautiful WOMAN leading a movie. I also was watching a video about how all the women in the Barbie movie have unique roles and stuff and the men are essentially the same. Some guys are upset over that too. Personally I'd love a successful wife who can take the spotlight but men with a fragile masculinity will never allow/want a woman to take the spotlight over them. Y'all already know this, we all know this. Even they know this",DSA300,3,0,2023-07-20 21:31:53
they’re literally just mad that’s she’s pretty and they can’t have her. that seems to be the general consensus these days.,viakitty,3,0,2023-07-20 21:46:32
"From those review percentages I'd say it's a perfect example of a vocal minority carrying on like pork chops about nothing. I've liked her in what I've seen her in, just not interested in seeing barbie",Xenu66,3,0,2023-07-21 01:02:47
"Gorgeous, successful, confident women a certain type of man seethe in fury.",NothingAndNow111,3,0,2023-07-21 01:17:07
In general I expect \~5% of any population to have an incomprehensible and unreasonable opinion about any subject. Ignoring them lets me appreciate an incredible score like 94%.,atombath,3,0,2023-07-21 04:07:25
"Hatred for anything that is feminine, just like the hatred for Taylor Swift. Misogyny plain and simple.",rvamama804,5,0,2023-07-20 22:28:19
"Because men are misogynistic pigs and they’re also insecure. If they were comfortable with themselves, they wouldn’t be trashing a gorgeous talented woman. They’re threatened by her and female empowerment. Also, female directors are held to impossibly high standards and unfortunately there are people that still today in 2023 don’t believe women should be directors. So that’s why loser men are trashing the movie too.",lalalady456,9,0,2023-07-20 20:06:09
94% audience score sounds like dudes aren't mad at all.,HopeEternalXII,11,0,2023-07-20 18:45:19
Maybe she doesn’t smile enough.,blue0mermaid,6,0,2023-07-21 00:07:14
Margot Robbie wasn't in Promising Young Woman!,normanbeets,8,0,2023-07-20 19:18:51
"They feel threatened. They’re trying to knock her down to make themselves feel better. I don’t understand how that actually works. 

I’ve seen it occasionally growing up. Denigrating for self-satisfaction must hide a really small ego.",HutcHJC,4,0,2023-07-20 20:26:17
They're just mad at women WINNING. This isn't exclusive to Margot Robbie. Remember *Wonder Woman*? *Captain Marvel?*,Exact_Roll_4048,4,0,2023-07-20 21:20:52
"Wait, did the Society of Creepy Repellant Overcompensating Terribly Unhygienic Mysogynists go on a field trip to watch the Barbie movie? Goddamn I’m outa the loop. I didn’t think members of S.C.R.O.T.U.M. Would be into that kinda movie",BaconBombThief,4,0,2023-07-20 21:34:12
The root? #masculinitysofragile,MistressofTechDeath,3,0,2023-07-20 21:43:49
We need to learn to ignore men instead of giving their fear-mongering statements any attention.,roseabides,4,0,2023-07-20 22:26:51
"Misogyny, same as always.",Resident-Librarian40,5,0,2023-07-20 22:34:07
"She's a female lead in a ""woke"" movie by a female director.

That's all the reason a lot of these guys need.",Click_To_Sign_In,4,0,2023-07-20 23:50:47
"It's the same reason they tore down Brie Larson. Women can't be successful, pretty and popular.",Flicksterea,3,0,2023-07-21 01:12:47
"I think it’s more about Ken the himbo. He is portrayed as Barbie’s creator intended him, arm Candy for Barbie. 

I guess they don’t like the role reversal.",Alternative_Let_1599,4,0,2023-07-21 02:14:23
I think it's so you know who to avoid. Like how all those racist shitheads were mad about the Little Mermaid being Black. Just a giant red flag they're waving in the face of everyone they meet.,Wikrin,6,0,2023-07-20 19:23:43
Am dude and was not aware of any hate towards Robbie. I'm stoked for Barbenheimer though.,warioman91,2,0,2023-07-20 20:12:51
Grown man here and quite looking forward to the Barbie movie. I love the plot idea of her and Ken leaving Barbie world.,LtRecore,2,0,2023-07-20 20:30:16
"I can't speak for all men but I've got no problem with her, she's been great in everything I've seen her in. I haven't seen the movie but Barbie is peak product placement in a movie, there are male equivalents like the marvel movies or non-gender de script like lego movies etc, doesn't seem like anything to get in a huff about really, people like the products enough that it branches into other forms of media and that's good for the people that enjoy it.",Winter55555,2,0,2023-07-20 20:36:49
[deleted],[deleted],2,0,2023-07-20 20:37:44
Because little men are scared of Barbies,Ok_Mycologist_5569,2,0,2023-07-20 20:53:29
misogyny,Pink-grey24,2,0,2023-07-20 21:03:17
"I think they're mad they could never get with someone as hot as Margot Robbie so they're trying to say she's not even hot. Like even if she's not your preference, why are you mad? So weird.",jaydesterr,2,0,2023-07-20 21:10:33
"They're upset that Margot Robbie will never know they exist. 

https://en.m.wikipedia.org/wiki/The_Fox_and_the_Grapes#:~:text=The%20story%20concerns%20a%20fox,grapes%22%20originated%20from%20this%20fable.",OhGawDuhhh,2,0,2023-07-20 21:15:46
"Ive read some of those negative reviews and I do not see anyone of them trashing Margot's performance or her looks.

&#x200B;

Most of the criticism is on the story.

&#x200B;

Where's the hatred?",graypod,2,0,2023-07-20 21:32:24
