Comment_Body,Author,Upvotes,Awards,Date
"I don’t think she looks remotely over 33, as if 33 is in any way old in the first place! She is beautiful and society’s perceptions of age and beauty standards are warped by social media / filters etc.

On top of this, I imagine a lot of the comments are spurred by jealousy, as sad as it is! Lots of people feel like acknowledging the beauty of another woman diminishes their own, and wish we would move away from this idea as a society!",Fuzzy-Donkey5538,259,0,2023-07-28 17:03:37
"Some zoomers are obsessive and crazy. They have this super strict set of unrealistic standards while claiming to be body positive (plot twist: they are not). They're terrified of the most mild signs of being older than your teens and literally consider anyone who's obviously a grown woman as ""old looking"". 

It's gotten to the point where they will even call certain bone structures, face shapes, or nose shapes ""young"" and ""old"" which doesn't even make any sense! 

It's very toxic and crazy, and I imagine they will end up in therapy. I'm active in a lot of beauty and skincare and the amount of 14 and 15 year olds who think they have wrinkles or sagging skin and want plastic surgery is rather concerning. They think they are supposed to look like a filter",HauntedButtCheeks,85,0,2023-07-28 18:06:43
These people are going to have a wild ride if they’re planning on looking better than Margot Robbie when they turn 33. Best of luck to them. Hope they’re putting back some of their skincare budget for therapy,thirstylearning,100,0,2023-07-28 17:51:24
"I think Margot is stunning. She is head to toe classical golden Hollywood era beautiful. She’s so photogenic. I don’t think anyone can argue that she’s not stunning if they someone does try to argue it then they’re probably jealous.   
  
She does have sun damage just like everyone else in Australia (I’m Australian btw). She’s wearing makeup in all of the pictures but you can still see a lot of her sun spots like underneath her eyes and there’s some prominent ones on the side of her forehead. They’re kind of blurred but definitely visible in the picture from Instagram you have there. The picture from the MET Gala shows them very clearly especially on her forehead. These types of spots you normally see on people who are older like closer to retirement but they’re common on people in Australia even in their early twenties and thirties. And yeah, her skin is crinklier for her age especially around her eyes and mouth which is from sun damage. ***But, does it make her less beautiful? I say no.***   
  
I don’t know why people pit it against her that she has sun damage or say her bone structure makes her look too mature. It’s not like she got to choose where she was born or her body. She’s still freaking gorgeous. There’s no procedure to my knowledge that can give anyone her big, bright, wide set seaglass eyes and her big smile.  
  
It’s true that Australians look older for their age compared to people in other parts of the world of the same age. The environment is so harsh and you’re still exposed to it on a daily basis if you’re trying to live your life because not even using sunscreen and shade is enough. I did my studies in Boston, USA and did summer road trips with friends through many states. Not that I was intentionally judging anyone but I couldn’t help notice during my first years there how many of my peers, who were mostly American students from all over the country and international students from China and India, looked much younger skin wise than my peers in Australia. Much less spotty  and crinkly around the eyes and more even skintone and just skin that looked firmer and thicker. 

But there are lot of things that can fix that type of stuff especially if you save some money and set aside time. Jealous and bad personalities are harder to fix if they can be fixed at all. I have never seen one of those people who say Margot is bad looking to ever volunteer to post their own pictures. They’re probably the same type of people who need to fish for compliments on social media.  


I don't equate numerical age for beauty and I don't think having bad skin or sun damage and stuff like that is a criteria for beauty. You can be beautiful with amazing personality but bad skin. You can have the most objectively beautiful skin but ugly with a bad personality that just makes someone even uglier.",northernbeautybelle,207,0,2023-07-28 17:11:49
People have a totally skewed idea of what skin looks like. It’s all the filters.,HallucinogenicFish,89,0,2023-07-28 17:31:33
"Its just the classic negging on men who are sad they are alone and shed never care for them, so they trying to make fun of things that they would reject her first, as if it were an option.

&#x200B;

Its like the default ""youre fat"" and ""youre old"" to try and insult people. dont listen to these people who cant even wash their arm pits with out mommas help trying to give skin reviews.",MeowMistiDawn,46,0,2023-07-28 17:34:32
"People have no idea that most photos and videos they see have been airbushed and ""de-aged."" They have to be: 99.9999% of people's attractiveness does not stand up to the scrutiny of the modern preference for white lighting and HD cameras. As for Margot specifically, I think it's because she has a thin face and (pretty normal) undereye lines when she smiles.",Beth_Harmons_Bulova,20,0,2023-07-28 17:11:40
"People should look young at 33 because 33 is young. 

This idiocy that women become hags at 30 years old has got to stop.",UDontKnowMe784,21,0,2023-07-28 18:43:00
I don't think she looks older. I think she looks her age but people don't have realistic ideas of what a 33 year old looks like anymore due to social media.,maraq,73,0,2023-07-28 17:18:57
"She has a sharp bone structure, people with such features look their age as they mature. She doesn’t look a day older than what she is. This is how 33 year old people look, and honestly she looks so beautiful. If you don’t take fillers & injections into consideration, the only people who look younger than their age are the ones with delicate bone structures and baby face features. The whole age shaming trend is such a  regressive phenomenon if you ask me. If people are so judgmental towards a beauty like Margot, god save the average looking ladies.",craycraymy,15,0,2023-07-28 18:02:42
I mayyyybe see one or two sunspots on her forehead in the third picture. It’s so unfortunate that we are bombarded with retouched/filtered ads and social media that some are starting to forget what real people look like. Along with people forgetting the lesson of “if you don’t have anything nice to say….” They waste their time tearing others down because they are jealous and bitter.,Taminella_Grinderfal,12,0,2023-07-28 17:24:40
"Margot Robbie is a woman that exists in the public light, so a billion shlubby mouthbreathers will pick apart every single human trait she has. 

I mean, for christ’s sake. She could have a single toe hair and people would talk about her hobbit feet or some shit for a year.",crowmakescomics,29,0,2023-07-28 17:51:33
It may be because she has a more mature face and not a baby face,Blarn__,12,0,2023-07-28 18:09:06
"If Margot Robbie, one of the most stunning females on the planet, looks “old” to you at 33 then we are all complete toast. Girl is stunning, she looks amazing. I feel like people can also forget that sometimes, without filler or makeup or anything, some people just have a more mature looking face. There’s nothing wrong that that. Just like how some people who have “baby cheeks” can look younger than they really are. Age is inevitable, I hope I look that great when 33 comes around",DiligentPersimmon153,12,0,2023-07-28 22:40:21
"She’s gorgeous and so what if she looks older than she used to? She is older than she used to be, so isn’t that okay? Looking 33 isn’t negative. Human beings don’t look like instagram filters, not even celebrities. IMO a lot of women look their most beautiful in their 30s & 40s. Facial fat loss from aging can bring out your natural bone structure in a good way. If you suffer from acne or severely oily skin, it’s likely to clear up. There are positive aspects to aging out of your 20s from a purely physical perspective that get no attention because we’re trained to fixate on every little expression line.",Wandering_Snu,22,0,2023-07-28 17:31:49
It's mostly guys saying women look old because they don't have gfs and watch porn and hentai all day of teenage girls getting taken advantage of. Then they hop on streaming platforms like twitch where young girls <18-25 thrive and wear kawaii style makeup.,xLuckyBunny,24,0,2023-07-28 18:55:09
"She looks 33. I’m 33. This is how I look. (Well, not a smoke show like her, but the same skin texture and small wrinkles)

The problem is, fillers, Botox, skin peels, etc. are all we see on female celebrities in media and on red carpets. So when a woman who hasn’t had work done is shown, we can’t correlate a normally aged 33 year old woman to the ones who have had plastic surgery or enhancements. 

Our culture has perpetuated a lie that woman over 30 are old. And that unless we strive to look 20, we have no value. It’s simply not true. She looks great. She looks her age. 

Note: This isn’t a dig at people who get fillers and Botox or other procedures. I’m all for doing whatever makes you feel best and I know in the future I’ll be ready to take that route too. This is more about comparing women and the media (and men’s) perception of women who choose not to slow aging.",thisiswhere-I-thrash,10,0,2023-07-28 18:33:16
I am 33 and she looks like a stunning 33 year old with skin that looks normal for her age .  People need to stop acting like woman shouldn’t show any signs of aging till they are 50 because its not how it works .,columbalivia2,11,0,2023-07-28 19:18:14
I personally can’t wait 2028-2032. 🍿 These delusional zoomers are going to cause a social catastrophe over none other than becoming the “hags” they so hastily shit on.,yimyamsuga,33,0,2023-07-28 18:10:17
I think that’s what a 33 year old blonde/caucasian woman looks like. I think the people complaining are probably the types who follow IG/tiktok models and are so used to filters.,wfhcat,34,0,2023-07-28 17:29:33
pro tip: dont read comments online about beautiful people. they will suck and make you feel worse and question reality. you could be a 10 and a basement dweller could say your nasial bla bla is not 100 in line with the other things.,Upinmybuttt,26,0,2023-07-28 17:36:05
Misogyny.,No-Ad-9867,11,0,2023-07-28 18:30:16
Omg stop with this aging shut. She’s gorgeous and actually a genuine seeming actress for once who is naturally beautiful,justoneminuteplease,9,0,2023-07-28 18:35:14
"I think when Margot was a little younger in her wolf of wall street days, due to the way she was styled, very fake bronze, very fake blonde, it had an effect of aging her or making her look like she was trying to look older. But she has always been beautiful, and any photo of her in more natural appearance she looks her age. I agree with everyone that no one knows what a 33 year old woman looks like anymore because social media has totally distorted our mental images.",Adverbage,9,0,2023-07-28 18:56:03
"She looks her age. The third picture, I think her makeup artist didn’t do her any favors with the foundation and concealer around her eyes. They used some very drying makeup that is making her look more wrinkly than she really is.",radbu107,9,0,2023-07-28 18:59:51
"People need therapy and/or new glasses she looks like a perfect angel (and I've got a fresh prescription, bishes)",electricmeatbag777,6,0,2023-07-28 17:58:18
"I do think she looks late 30s but it’s not because she has bad skin (she has excellent skin), it’s because she has a very angular face with no baby fat, and because she carries herself with maturity.",tonguetwister,6,0,2023-07-28 20:08:46
I can’t wait for all the judgy youngsters to age. 🙄,marnfl,6,0,2023-07-28 23:45:05
"People like to say everything is sun damage because they like the idea of a big chunk of aging being preventable with sunscreen. They so desperately want to believe that they will look 18 at 33 because they started using sunscreen at a young age. Newsflash, sun damage or not you will still age.",sanecandy,6,0,2023-07-29 02:40:18
"She’s beautiful. She looks natural, attractive. The problem is we are pushing the narrative  that the new attractive is plastic, filler and Botox.",Wide-Market-9199,36,0,2023-07-28 17:29:45
They can't see anything. The people saying this are insecure little boys and girls.,Alone-Assistance6787,6,0,2023-07-28 17:46:39
"Some people get really weird about celebrities aging. I’ve noticed it most with female actresses/models and male rock stars. Hell, go into any thread about an 80s band and there will be tons of “what happened to xyz musician!” — I tend to think that celebrities that are idolized as really beautiful or cool tend to fall under this scrutiny more while others are given slightly more grace and acknowledgment of the passage of time. 

It’s like a weird form of nostalgia where they’re expected to freeze time at the moment they were first introduced to the public. 

Anyone saying Margot Robbie looks terrible must have either ridiculously high standards or isnt viewing her objectively.",BrokenNecklace23,6,0,2023-07-28 18:00:26
By God that woman is gorgeous 👁️👄👁️,Burpeeandpoo,23,0,2023-07-28 17:27:14
"She has always looked older but of course not ""old"". I think  it's because her mature and at the same time gorgeous bone struture. When I saw her in ""The Wolf of Wall Street"" I thought she was in her early thirties. There were even rumours back then that she was older than she claimed to be.",Illustrious_Letter88,10,0,2023-07-28 17:37:12
"When you're used to seeing yourself and all your friends (and influencers) through Snapchat filters, you lose sight of what real humans look like.",Ryboticpsychotic,5,0,2023-07-28 17:43:59
Lol she looks amazing. I don't see sun damage. She looks her age but ridiculously good for it.,Persist3ntOwl,5,0,2023-07-28 17:51:08
I wish every anonymous internet troll who criticizes another person’s looks had to first post what they look like themselves.,mentionitallll,5,0,2023-07-28 17:57:41
"People on the internet are brutal with dissecting women’s looks. She looks her age to me and has great skin. She looks almost exactly like she did in her early 20s/late teens. She has never had a baby face that would make someone assume she’s much younger. Her face doesn’t appear totally frozen by Botox, nor does it look like she’s had excessive injectables, a brow lift, or a face lift. All of the above are so common with modern celebs and there seems to be an expectation that no famous woman 12-50 should have any visible lines, wrinkles, puffiness etc. 

I have the same lower eyelid anatomy she has- as I’ve gotten older its gotten more pronounced and puffy. But I have ALWAYS (since a baby!) had puffiness and creases under my eyes, as well as dark circles. For many this is just their genetic facial anatomy.",aliquotiens,4,0,2023-07-28 18:25:01
"I think she looks great! I'm also 33, and I have pretty much identical crows feet. I also have some forehead creases, but I get dysport for those because they bother me. I did have dysport injected in my crows feet once, but I didn't care for the result, so I stopped for now 🤷‍♀️",Thornelake,5,0,2023-07-28 18:32:46
"Jesus, people on the internet are so brainwashed by filters. I swear they’ve never seen a real 33yo woman.",amora_obscura,5,0,2023-07-28 18:44:37
I she looks mature and not some overly filtered 20 something trying to look like a zygote.,KittenMittens6085,4,0,2023-07-28 19:16:41
I’m clearly the minority here but she looks at least 38 to me here and much older than some of my friends who are mid 30’s. What makes her look old to me is simply her eye area and deep set eyes tend to make folks look older quicker. Then you throw in the work she’s had done and that automatically ages most people when you do as much as she has. She’s gorgeous but TIL she is only 33 when I thought she was in her early 40’s. I even thought to myself it was awesome they had an older actress playing Barbie.,studyhardbree,4,0,2023-07-28 20:27:07
"She looks 33 to me. That feels like some incel shit (“this super hot celebrity is mid, I wouldn’t hit that”).",pedanticlawyer,5,0,2023-07-28 20:55:54
"People are so mean. She's gorgeous, let her be",RevolutionaryTip6744,5,0,2023-07-28 22:54:36
"If we are honestly over here picking apart someone like Morgot Robbie, the rest of us might as well just pack it in. The woman is absolutely stunning, and she looks exactly as she should for whatever life stage she's in.",Athena-Rising34,5,0,2023-07-28 23:37:59
This thread has made me sad about gen Z,iNomNomNomNom,5,0,2023-07-29 02:25:37
"she doesn’t look older, the internet has made people forget what real skin looks like. speaking as an esthetician, her skin looks great, minimal fine lines, good texture and tone",rissmi,6,0,2023-07-29 02:25:39
"People are hating on her because she’s in a film that they perceive as being extreme feminist so they’ve got to take her down a couple notches in their mind. I’d LOVE to see the skin of these “lots of people” saying she looks older and do a side by side of them with Margot :)

She’s fucking hot. She’s 33 not 25. She looks 33. Yes you may have some wrinkles when you’re 33. You may not. But she’s also light skin and more prone to sun damage and premature aging. 

But imo everyone can f*** right off unless they’re on her level or hotter which I doubt any of these s*** talking dickw*** are. 

I’ve also read people calling her “mid”. Okay yeah she’s mid. If she’s mid I’m a naked mole rat living twelve feet bellow the ground. Blind of course because I have no need to see.",big_seacucumber,5,0,2023-07-29 03:57:24
"I do think she’s had some Botox which is fine lol. She does have some dynamic wrinkles which are perfectly normal to have, there are times where it seems like botox is fading and you can see them more. She’s still beautiful regardless. It’s okay to look any age.",BreadOnCake,12,0,2023-07-28 17:12:23
Well she is Australian right? I’m sure she got lots of sun growing up.,b0toxBetty,12,0,2023-07-28 17:28:15
She looks 30-33 to me.,Janeeee811,12,0,2023-07-28 17:45:04
broad bone structure say what? her features are tiny and pretty close together,sweetsadnsensual,24,0,2023-07-28 17:00:35
She definitely looks 33. She just has very strong bone structure and minimal body fat,Necessary-Blueberry5,20,0,2023-07-28 17:48:06
I see someone who has smile lines because they smile with their whole face. And that’s beautiful.,wiggysbelleza,3,0,2023-07-28 18:15:35
"TIL I’m the same age as Margot Robbie. She looks like she has the exact same issues with under eye concealer and the same smile line/texture as me so I would say she’s pretty spot on for her age. Also, I have pretty nice skin, but too much or the wrong makeup can REALLY age me. Normal people like me can choose to wear less makeup, but for people who are going to be photographed for events or on stage will look kind of weird if they don’t do a full face, but the downside is that it really emphasizes lines and texture close up.",Nachogem,4,0,2023-07-28 18:37:38
"Agreeing with most comments here. I have a feeling that we have gotten used to seeing so many 30 y.o. with Botox to prevent expression lines in the future, that when we see someone without it, we’re surprised at how “old” they look. 
In the picture where her face is relaxed, we can’t really see the crows feet around the eyes. My guess is that she doesn’t do as much Botox as the Hollywood average.",juniorvegetable106,3,0,2023-07-28 18:42:38
"There's are whole subs that rate celebrities looks and they pick apart the tiniest minutia and give total babes like a 5 or 6 then say"" but I'd still bang her.""

How generous of you!

Don't listen to those weebs.",fartichokehearts,3,0,2023-07-28 18:57:15
"Honestly I’m 37 and always thought she was older than me just because she’s so elegant and graceful. I feel like a potato meatball in comparison so my brain automatically goes “she must be older than me to look so elegant”

I don’t think she looks “old” she just looks like she has herself more together. I don’t follow a ton of celeb stuff but she looks way younger to me in the makeup-free pics. She looks amazing for her age. Or for any age!",phalseprofits,5,0,2023-07-28 19:11:50
"✨ Margot Robbie stars in film which is about women trying to exist ✨ internet potato calls Margot old 👏🏻 

HONESTLY 🫠",Key_Faithlessness211,4,0,2023-07-28 19:13:31
"If she looks older, I look deceased",cojavim,4,0,2023-07-28 19:26:41
I don't think she looks older because of wrinkles but I think she does have an older mature look to her... I can't place exactly what it is.,Cultural-Football737,4,0,2023-07-28 19:31:04
"genuinely, every skin has texture. i’m 18 and i have more wrinkles than her.",witcheling,4,0,2023-07-28 20:09:10
She does look a little older... than she did when she was younger.,m2thek,4,0,2023-07-28 20:47:57
"She smokes cigarettes.  That has a known impact on skin, and she admits to having chain smoked for some of her recent roles.  

Good looking for sure, and she looks a bit like she smokes - which she does.",Natural-Meaning-2020,5,0,2023-07-28 21:14:14
She is 33 and she looks exactly 33.,Citronella262829,4,0,2023-07-28 22:48:06
She looks 33. People are dumb.,natinigill,5,0,2023-07-28 23:20:19
Can we let women age please,Future_Boss_9844,4,0,2023-07-28 23:37:40
"I think she looks fantastic and as youthful as she should at 33 

She’s just so hot right now that she’s a lightening rod for hate",Runny_yoke,3,0,2023-07-29 00:27:59
She is a beautiful woman who is successful so now they will tear her down.,letsdothisthing88,4,0,2023-07-29 00:38:02
I’m sure most of the weirdos criticizing her looks would be absolutely stunned/awestruck if they were actually in her presence.,dizug,4,0,2023-07-29 02:01:33
Lol dunno. She looks a lot better than me and I’m 32.,Dinosaurshad_feather,4,0,2023-07-29 02:06:42
"People have forgotten what normal aging, normal skin, and normal sun stuff looks like.",Bubbly_Performer4864,4,0,2023-07-29 02:27:10
"Not a comment I've seen yet so I'll say it now. We are living in a patriarchy where a lot of people believe women ""hit the wall"" at the age of 30. 🙄 That should give you all you need to understand what's happening.",HottskullxD,4,0,2023-07-29 04:42:51
"I just googled her age earlier today because I thought she was 35+. I don't know if it's because of her looks, or because Wolf of Wall Street came out 10 years ago and I did not realize she was 21-22 when that was filmed. I had no clue she was that young. She looked very mature for 22 (not old but someone who was prob getting to bars no problem underage). It could also speak to her acting ability that made her seem older in Wolf of Wall Street. 

It seems like we've been seeing her in movies for a long time so I just thought she was older than 33.

Edit to add: Vanessa Hudgens is 1 year older than her. Zac Efron is 2 years older. Ashley Tisdale is 5 years older. Weird to think these Disney Stars are older! I just couldn't imagine them doing Wolf of Wall Street because they would look like children. But Margot was even younger!",AsIfLeo,9,0,2023-07-28 18:07:49
"Not in this pic, but I did see a recent interview and she had crows feet. 33 is young to have those kinds of lines around the eyes. Maybe it's her makeup. Makeup has a way of aging ppl.",Smooth-Percentage007,10,0,2023-07-28 18:24:14
"Also, depending on how much we drink either alcohol or water, our time during our cycles, stress, etc your face/facial lines can fluctuate a bit. I feel like i look old at the time when i have the least estrogen, and feel at the top when i am between cycles.


Again, agree with commenters about non retouched photos  as well. She looks great.",acornwbusinesssocks,9,0,2023-07-28 17:16:51
"She most likely had buccal fat removal, among other work, early in her career (like a decade ago), which made her look older even in her early twenties. https://youtu.be/cPZb9a3DvS4

To me now she looks more her age than when she was in her twenties.",putacatonityo,12,0,2023-07-28 17:36:14
"Isn’t it surprising that people can’t come to the conclusion that some people age faster than others. It’s all in our genetic makeup, I know people who never wear anything and have great skin, and I know the opposite also. I’m sure there are other factors, but we age people. No one looks 15 forever.",Tucobro,3,0,2023-07-28 18:10:34
Well I think she's just perfect 😍,anna_anastazja,3,0,2023-07-28 18:29:12
People have too much time to critique other people. Simple as that!,Radiant_Guava_8434,3,0,2023-07-28 19:08:47
Mid because Barbie. I'f she was in sou d of freedom she would have been labeled Helen of Troy,Nyx81,3,0,2023-07-28 19:15:57
"The usual photos we see of celebrities are heavily airbrushed and filtered, that’s why it’s such a shock to see what they really look like. They look like real people with imperfections in real life",zaritza8789,3,0,2023-07-28 19:22:11
"She’s a few months younger than me, and I have always thought that she was a little older than me. It has nothing to with her skin looking aged in any way, she just has always (since wolf of wall street) seemed so mature and put together. Maybe it has something to do with her bone structure, but she is gorgeous and I think she will age beautifully.",ALadySquirrel,3,0,2023-07-28 19:23:40
